M,WT,Netcompany INEOS,GANNA Filippo,Italy,29,25 July 1996,Verbania,1.93,83,40,65,"8x stage Giro d'Italia ('26, '24, '21, '20)","2x World Championships ME - ITT ('21, '20)",Dwars door Vlaanderen ('26),INEOS Grenadiers,Team INEOS,UAE Team Emirates,Team Colpack,Lampre - Merida,Viris Maserati - Sisal,GS Aspiratori Otelli,,,,,,,,TT,
M,WT,Netcompany INEOS,GODON Dorian,France,30,25 May 1996,Vitry-sur-Seine,1.89,74,21,37,"4x stage Tour de Romandie ('26, '24)",De Brabantse Pijl - La Flèche Brabançonne ('23),Coppa Bernocchi ('25),Decathlon AG2R La Mondiale Team,AG2R Citroën Team,AG2R La Mondiale,"Cofidis, Solutions Crédits",Team Vulco Vc Vaulx En Velin,Team Vulco - VC Vaulx-en-Velin,,,,,,,,,Hills,
M,WT,Netcompany INEOS,HAIG Jack,Australia,32,6 September 1993,Southport,1.90,67,2,,stage Tour de Pologne ('17),3rd GC Vuelta a España ('21),2nd GC Volta a la Comunitat Valenciana ('20),Bahrain - Victorious,Mitchelton-Scott,ORICA-Scott,ORICA-BikeExchange,Orica GreenEDGE,Jayco-AIS World Tour Academy,Avanti Racing Team,Huon Salmon Genesys Wealth Advisers p/b Praties,,,,,,,GC,
M,WT,Netcompany INEOS,HAMILTON Lucas,Australia,30,12 February 1996,Ararat,1.84,71,4,,Oceania Continental Championships ME - Road Race ('17),GC Settimana Internazionale Coppi e Bartali ('19),stage Tirreno-Adriatico ('20),INEOS Grenadiers,Team Jayco AlUla,Team BikeExchange - Jayco,Team BikeExchange,Mitchelton-Scott,Mitchelton Scott,Jayco-AIS World Tour Academy,,,,,,,,GC,
M,WT,Netcompany INEOS,HEIDUK Kim,Germany,26,3 March 2000,Herrenberg,1.84,70,0,,stage Tour d'Eure-et-Loir ('21),2nd GC Orlen Nations Grand Prix ('21),2nd GC Tour d'Eure-et-Loir ('21),INEOS Grenadiers,Team Lotto - Kern Haus,WRSV Holczer Radsporteam,,,,,,,,,,,,Hills,
M,WT,Netcompany INEOS,JUNGELS Bob,Luxembourg,33,22 September 1992,Rollingen,1.89,70,27,,Liège - Bastogne - Liège ('18),stage Tour de France ('22),Kuurne-Brussel-Kuurne ('19),INEOS Grenadiers,Red Bull - BORA - hansgrohe,BORA - hansgrohe,AG2R Citroën Team,Deceuninck - Quick Step,Quick-Step Floors,Etixx - Quick Step,Trek Factory Racing,RadioShack - Leopard,Leopard - Trek Continental Team,,,,,TT,
M,WT,Netcompany INEOS,KWIATKOWSKI Michał,Poland,36,2 June 1990,Chełmża,1.76,68,32,,World Championships ME - Road Race ('14),"2x Amstel Gold Race ('22, '15)",Milano-Sanremo ('17),INEOS Grenadiers,Team INEOS,Team Sky,Etixx - Quick Step,Omega Pharma - Quick-Step,RadioShack,Caja Rural,,,,,,,,Oneday,
M,WT,Netcompany INEOS,LANGELLOTTI Victor,mc,30,7 June 1995,Monaco,1.77,64,3,156,stage Tour de Pologne ('25),2nd GC Tour of Norway ('25),stage Presidential Cycling Tour of Türkiye ('23),INEOS Grenadiers,Burgos - BH,UC Monaco,,,,,,,,,,,,GC,
M,WT,Netcompany INEOS,LAURANCE Axel,France,25,13 April 2001,Calan,1.79,63,9,136,GC Tour of Norway ('24),World Championships MU - Road Race ('23),stage Volta a Catalunya ('24),INEOS Grenadiers,Alpecin - Deceuninck,Alpecin-Deceuninck Development Team,B&B Hotels - KTM,B&B Hotels p/b KTM,VC Pays de Loudéac,Van Rysel - AG2R La Mondiale,B'Twin U19 AG2r La Mondiale,Véloce Vannetais,,,,,,Hills,
M,WT,Netcompany INEOS,ONLEY Oscar,Great Britain,23,13 October 2002,Kelso,1.73,62,2,19,stage Tour de Suisse ('25),stage Tour Down Under ('24),2nd GC Tour of Guangxi ('24),Team Picnic PostNL,Team dsm-firmenich PostNL,Team dsm - firmenich,Development Team DSM,Van Rysel - AG2R La Mondiale,,,,,,,,,,GC,
M,WT,Netcompany INEOS,RIVERA Brandon Smith,Colombia,30,21 March 1996,Zipaquirá,1.70,60,3,,Pan-American Continental Championships ME - ITT ('19),stage Tour of Austria ('24),2nd GC Tour of Austria ('24),INEOS Grenadiers,GW - Shimano,UC Monaco,,,,,,,,,,,,GC,
M,WT,Netcompany INEOS,RODRÍGUEZ Carlos,Spain,25,2 February 2001,Almuñécar,1.83,67,7,228,GC Tour de Romandie ('24),stage Tour de France ('23),"2x stage Itzulia Basque Country ('24, '22)",INEOS Grenadiers,Polartec - Kometa Junior Team,,,,,,,,,,,,,GC,
M,WT,Netcompany INEOS,RODRÍGUEZ Óscar,Spain,31,6 May 1995,Burlada,1.79,63,1,,stage Vuelta a España ('18),2nd GC Vuelta a Burgos ('19),2nd GC Tour de Hongrie ('22),INEOS Grenadiers,Movistar Team,Astana - Premier Tech,Astana Pro Team,Euskadi Basque Country - Murias,Euskadi - Murias,Lizarte,,,,,,,,GC,
M,WT,Netcompany INEOS,SHEFFIELD Magnus,United States,24,19 April 2002,Coon Rapids,1.83,73,4,205,De Brabantse Pijl - La Flèche Brabançonne ('22),stage Paris-Nice ('25),stage Vuelta a Andalucia Ruta Ciclista Del Sol ('22),INEOS Grenadiers,Rally Cycling,Hot Tubes Development Cycling Team,,,,,,,,,,,,TT,
M,WT,Netcompany INEOS,SHMIDT Artem,United States,22,30 January 2004,Cumming,1.91,76,2,237,Classique Dunkerque / Grand prix des Hauts de France ('26),National Championships United States ME - ITT ('25),stage Istarsko Proljeće - Istrian Spring Trophy ('23),INEOS Grenadiers,Hagens Berman Jayco,Hagens Berman Axeon,Hot Tubes Development Cycling Team,LUX Cycling,,,,,,,,,,Oneday,
M,WT,Netcompany INEOS,SVESTAD-BÅRDSENG Embret,Norway,23,1 September 2002,Oslo,,,0,,2nd Gylne Gutuer ('21),2nd Sundvolden GP ('22),8th GC Tour of Oman ('25),Arkéa - B&B Hotels,Arkéa - B&B Hôtels Continentale,Human Powered Health,Team Coop,Glåmdalen SK,,,,,,,,,,GC,
M,WT,Netcompany INEOS,SWIFT Ben,Great Britain,38,5 November 1987,Rotherham,1.79,69,15,,GC Tour de Picardie ('10),2x stage Tour de Pologne ('12),2x stage Tour Down Under ('11),INEOS Grenadiers,Team INEOS,UAE Team Emirates,Team Sky,Sky Procycling,Team Katusha,Barloworld,,,,,,,,Oneday,
M,WT,Netcompany INEOS,SWIFT Connor,Great Britain,30,30 October 1995,Thorne,1.90,75,3,,Tro-Bro Léon ('21),GC Tour Poitou - Charentes ('21),National Championships Great Britain ME - Road Race ('18),INEOS Grenadiers,Team Arkéa Samsic,Madison Genesis,Team Dimension Data,,,,,,,,,,,Oneday,
M,WT,Netcompany INEOS,TARLING Joshua,Great Britain,22,15 February 2004,Aberaeron,1.94,78,9,,stage Giro d'Italia ('25),"2x Chrono des Nations ('25, '23)",stage Renewi Tour ('23),INEOS Grenadiers,Flanderscolor - Galloo Team,,,,,,,,,,,,,TT,
M,WT,Netcompany INEOS,TURNER Ben,Great Britain,27,28 May 1999,Doncaster,1.94,74,3,118,stage Vuelta a España ('25),Vuelta a la Región de Murcia ('23),stage Tour de Pologne ('25),INEOS Grenadiers,Trinity Racing,Trinity Road Racing,Corendon - Circus,HMT Academy JLT Condor,,,,,,,,,,Hills,
M,WT,Netcompany INEOS,VAUQUELIN Kévin,France,25,26 April 2001,Bayeux,1.76,69,10,28,stage Tour de France ('24),GC Etoile de Bessèges ('25),GC Tour des Alpes-Maritimes ('23),Arkéa - B&B Hotels,Team Arkéa Samsic,VC Rouen 76,UC Tilly Val de Seulles,,,,,,,,,,,GC,
M,WT,Netcompany INEOS,WATSON Samuel,Great Britain,24,24 September 2001,Leeds,1.88,68,6,175,GC Quatre Jours de Dunkerque ('25),stage Tour de Romandie ('25),stage Tour Down Under ('26),INEOS Grenadiers,Groupama - FDJ,Equipe continentale Groupama-FDJ,Trinity Racing,Team Inspired,Fensham Howes-MAS Design,,,,,,,,,Hills,
M,WT,Netcompany INEOS,WELSFORD Sam,Australia,30,19 January 1996,Subiaco,1.82,79,13,,"7x stage Tour Down Under ('26, '25, '24)",Grand Prix Criquielion ('23),stage Renewi Tour ('23),Red Bull - BORA - hansgrohe,Team dsm - firmenich,Team DSM,Northern Beaches Cycling Club,Pro Racing Sunshine Coast,Australian Cycling Academy - Ride Sunshine Coast,Satalyst Giant Racing Team,,,,,,,,Sprint,
M,WT,Netcompany INEOS,ØXENBERG Peter,Denmark,20,23 October 2005,Nørreby,1.91,69,0,,stage Alpes Isère Tour ('26),stage Orlen Nations Grand Prix ('24),2nd GC Alpes Isère Tour ('26),INEOS Grenadiers,Team Lotto Kern-Haus PSD Bank,Team ColoQuick,Team Vifra Kvickly Odder Junior,Team Odense,,,,,,,,,,TT,
M,WT,Red Bull - BORA - hansgrohe,ALEOTTI Giovanni,Italy,27,25 May 1999,Mirandola,1.80,64,7,,GC Tour of Slovenia ('24),"2x GC Sibiu Cycling Tour ('22, '21)","3x stage Sibiu Cycling Tour ('22, '21)",BORA - hansgrohe,Cycling Team Friuli ASD,Cycling Team Friuli,ASD Sancarlese Ciclismo,,,,,,,,,,,GC,
M,WT,Red Bull - BORA - hansgrohe,BOICHIS Adrien,France,23,2 January 2003,Aix-en-Provence,Weight: 68 kg,68,0,,GC Istrian Spring Tour ('25),4th Trofeo Calvià ('26),4th stage Settimana Internazionale Coppi e Bartali ('26),Red Bull - BORA - hansgrohe Rookies,Trinity Racing,,,,,,,,,,,,,Hills,
M,WT,Red Bull - BORA - hansgrohe,CATTANEO Mattia,Italy,35,25 October 1990,Alzano Lombardo,1.84,67,4,,Giro dell'Appennino ('19),stage Tour de Pologne ('23),stage Tour de Luxembourg ('21),Soudal Quick-Step,Quick-Step Alpha Vinyl Team,Deceuninck - Quick Step,Androni Giocattoli - Sidermec,Androni - Sidermec - Bottecchia,Lampre - Merida,Lampre - ISD,UC Trevigiani,,,,,,,TT,
M,WT,Red Bull - BORA - hansgrohe,DENZ Nico,Germany,32,15 February 1994,Waldshut-Tiengen,1.83,71,7,,"3x stage Giro d'Italia ('25, '23)",Tour de Vendée ('18),stage Tour de Suisse ('22),BORA - hansgrohe,Team DSM,Team Sunweb,AG2R La Mondiale,Chambéry Cyclisme Formation,LV Team Rothaus Baden,,,,,,,,,Hills,
M,WT,Red Bull - BORA - hansgrohe,DRIZNERS Jarrad,Australia,27,31 May 1999,Adelaide,1.86,70,0,,4th GC Flanders Tomorrow Tour ('21),10th stage Vuelta a España ('23),7th stage Volta ao Algarve em Bicicleta ('21),Lotto,Lotto Dstny,Lotto Soudal,Hagens Berman Axeon,SASI Cycling Team,,,,,,,,,,GC,
M,WT,Red Bull - BORA - hansgrohe,ETXEBERRIA Haimar,Spain,22,8 September 2003,Irún,1.77,65,1,215,Vuelta a Castilla y Leon ('25),4th Circuito de Getxo - Memorial Hermanos Otxoa ('25),5th Tour de Vendée ('25),Equipo Kern Pharma,Equipo Finisher - Kern Pharma,EOLO-Kometa U23,Equipo Amateur Caja Rural - Seguros RGA,Buruntzazpi,,,,,,,,,,Oneday,
M,WT,Red Bull - BORA - hansgrohe,EVENEPOEL Remco,Belgium,26,25 January 2000,Aalst,1.71,63,74,3,"2x Liège - Bastogne - Liège ('23, '22)","3x Donostia San Sebastian Klasikoa ('23, '22, '19)",GC Vuelta a España ('22),Soudal Quick-Step,Quick-Step Alpha Vinyl Team,Deceuninck - Quick Step,Acrog - Balen BC Junior,Forte U19 Cycling Team,,,,,,,,,,TT,
M,WT,Red Bull - BORA - hansgrohe,FISHER-BLACK Finn,New Zealand,24,21 December 2001,Benenden,1.89,69,6,,Muscat Classic ('24),stage Tour of Oman ('24),GC Istarsko Proljeće - Istrian Spring Trophy ('21),UAE Team Emirates,Jumbo-Visma Development Team,Willebrord Wil Vooruit,Team Skoda Fruzio,,,,,,,,,,,Hills,
M,WT,Red Bull - BORA - hansgrohe,HAJEK Alexander,Austria,22,19 July 2003,Hainburg an der Donau,1.76,55,1,,National Championships Austria ME - Road Race ('24),4th GC Tour de Hongrie ('25),3rd GC Carpathian Couriers Race in memory of Wacław Felcz ('22),Tirol KTM Cycling Team,Trinity Racing,Team Auto Eder,,,,,,,,,,,,GC,
M,WT,Red Bull - BORA - hansgrohe,HERZOG Emil,Germany,21,6 October 2004,Simmerberg,1.84,74,0,,2nd stage Volta Comunitat Valenciana ('26),3rd stage Tour of the Alps ('25),7th Milano - Torino ('24),Hagens Berman Axeon,Team Auto Eder,,,,,,,,,,,,,Hills,
M,WT,Red Bull - BORA - hansgrohe,HINDLEY Jai,Australia,30,5 May 1996,Perth,1.75,60,9,38,GC Giro d'Italia ('22),"2x stage Giro d'Italia ('22, '20)",stage Tour de France ('23),BORA - hansgrohe,Team DSM,Team Sunweb,Mitchelton Scott,Attaque Team Gusto,Jayco-AIS World Tour Academy,Aran Cucine Vejus,,,,,,,,Climber,
M,WT,Red Bull - BORA - hansgrohe,LIPOWITZ Florian,Germany,25,21 September 2000,Laichingen,1.81,68,3,10,GC Czech Tour ('23),GC Sibiu Cycling Tour ('24),3rd GC Tour de France ('25),BORA - hansgrohe,Tirol KTM Cycling Team,,,,,,,,,,,,,GC,
M,WT,Red Bull - BORA - hansgrohe,MARIT Arne,Belgium,27,21 January 1999,Galmaarden,1.85,72,2,190,Grand Prix du Morbihan ('21),Trofeo Palma ('26),Grand Prix Criquielion ('19),Intermarché - Wanty,Intermarché - Circus - Wanty,Sport Vlaanderen - Baloise,Lotto - Soudal U23,,,,,,,,,,,Oneday,
M,WT,Red Bull - BORA - hansgrohe,MARTÍNEZ Daniel Felipe,Colombia,30,25 April 1996,Soacha,1.74,63,15,168,GC Critérium du Dauphiné ('20),GC Itzulia Basque Country ('22),GC Volta ao Algarve em Bicicleta ('23),INEOS Grenadiers,EF Pro Cycling,EF Education First,Team EF Education First - Drapac p/b Cannondale,Wilier Triestina - Selle Italia,Wilier - Southeast,Team Colombia,UCI WCC Men's Team,,,,,,,GC,
M,WT,Red Bull - BORA - hansgrohe,MEEUS Jordi,Belgium,27,1 July 1998,Lommel,1.90,80,18,21,Copenhagen Sprint ('25),stage Tour de France ('23),Primus Classic ('22),BORA - hansgrohe,SEG Racing Academy,Acrog-Balen BC,Acrog - Balen BC Junior,Balen BC Junior,,,,,,,,,,Oneday,
M,WT,Red Bull - BORA - hansgrohe,MOSCON Gianni,Italy,32,20 April 1994,Trento,1.80,71,11,,GC Tour of Guangxi ('18),GC Arctic Race of Norway ('16),Giro della Toscana ('18),Soudal Quick-Step,Astana Qazaqstan Team,INEOS Grenadiers,Team INEOS,Team Sky,Zalf Euromobil Désirée Fior,,,,,,,,,Oneday,
M,WT,Red Bull - BORA - hansgrohe,PELLIZZARI Giulio,Italy,22,21 November 2003,San Severino Marche,1.83,66,4,24,GC Tour of the Alps ('26),stage Vuelta a España ('25),2x stage Tour of the Alps ('26),VF Group - Bardiani CSF - Faizanè,Green Project - Bardiani CSF - Faizanè,Bardiani-CSF-Faizanè,ASD U.C. Foligno,,,,,,,,,,,Climber,
M,WT,Red Bull - BORA - hansgrohe,PITHIE Laurence,New Zealand,23,17 July 2002,Christchurch,1.85,74,5,67,Cadel Evans Great Ocean Road Race ('24),GC Quatre Jours de Dunkerque ('26),Cholet - Pays de la Loire ('23),Groupama - FDJ,Equipe continentale Groupama-FDJ,Willebrord Wil Vooruit,,,,,,,,,,,,Oneday,
M,WT,Red Bull - BORA - hansgrohe,ROGLIČ Primož,Slovenia,36,29 October 1989,Trbovlje,1.77,65,91,52,"4x GC Vuelta a España ('24, '21, '20, '19)","15x stage Vuelta a España ('24, '23, '22, '21, '20, '19)",GC Giro d'Italia ('23),Jumbo-Visma,Team Jumbo-Visma,Team LottoNL-Jumbo,Adria Mobil,Radenska,,,,,,,,,,Climber,
M,WT,Red Bull - BORA - hansgrohe,THORNLEY Callum,Great Britain,22,5 August 2003,Edinburgh,1.90,76,1,,stage Sibiu Cycling Tour ('25),Il Piccolo Lombardia ('25),3rd GC Istrian Spring Tour ('25),Red Bull - BORA - hansgrohe Rookies,Trinity Racing,Spokes Racing Team,,,,,,,,,,,,TT,
M,WT,Red Bull - BORA - hansgrohe,TRATNIK Jan,Slovenia,36,23 February 1990,Idrija,1.73,67,12,,Omloop Het Nieuwsblad ME ('24),stage Giro d'Italia ('20),GC Tour de Slovaquie ('17),Team Visma | Lease a Bike,Jumbo-Visma,Bahrain - Victorious,Bahrain - McLaren,Bahrain Merida,CCC Sprandi Polkowice,Amplatz - BMC,Tirol Cycling Team,Radenska,Quickstep Cycling Team,Zheroquadro Radenska,Radenska KD Financial Point,,,TT,
M,WT,Red Bull - BORA - hansgrohe,TUCKWELL Luke,Australia,21,21 June 2004,Orange,1.82,66,0,,2nd GC Giro d'Italia Next Gen ('25),6th GC Tour de Romandie ('26),6th GC Ronde de l'Isard ('24),Red Bull - BORA - hansgrohe Rookies,Trinity Racing,Bathurst CC,InForm TMX MAKE,,,,,,,,,,,GC,
M,WT,Red Bull - BORA - hansgrohe,VAN DIJKE Mick,Netherlands,26,15 March 2000,Goes,1.90,74,0,,GC Flanders Tomorrow Tour ('21),2x stage Flanders Tomorrow Tour ('21),3rd GC CRO Race ('21),Team Visma | Lease a Bike,Jumbo-Visma,Team Jumbo-Visma,Jumbo-Visma Development Team,,,,,,,,,,,Oneday,
M,WT,Red Bull - BORA - hansgrohe,VAN DIJKE Tim,Netherlands,26,15 March 2000,Goes,1.89,74,2,180,2nd Omloop Nieuwsblad ME ('26),2nd Grand Prix de Denain ('23),stage CRO Race ('21),Team Visma | Lease a Bike,Jumbo-Visma,Jumbo-Visma Development Team,,,,,,,,,,,,Oneday,
M,WT,Red Bull - BORA - hansgrohe,VAN GILS Maxim,Belgium,26,25 November 1999,Brasschaat,1.74,63,7,224,Eschborn-Frankfurt ('24),GC Saudi Tour ('22),Grosser Preis des Kantons Aargau ('24),Lotto Dstny,Lotto Soudal,Lotto - Soudal U23,WAC Team Hoboken,,,,,,,,,,,Oneday,
M,WT,Red Bull - BORA - hansgrohe,VAN POPPEL Danny,Netherlands,32,26 July 1993,Moergestel,1.84,82,24,187,"2x Binche - Chimay - Binche / Memorial Frank Vandenbroucke ('21, '18)",stage Vuelta a España ('15),Halle Ingooigem ('18),BORA - hansgrohe,Intermarché - Wanty - Gobert Matériaux,Circus - Wanty Gobert,Team Jumbo-Visma,Team LottoNL-Jumbo,Team Sky,Trek Factory Racing,Vacansoleil - DCM,Rabobank Continental Team,,,,,,Sprint,
M,WT,Red Bull - BORA - hansgrohe,VERMEERSCH Gianni,Belgium,33,19 November 1992,Roeselare,1.73,68,4,170,Dwars door het Hageland ('24),Antwerp Port Epic / Sels Trophy ('20),Slag om Norg ('17),Alpecin - Deceuninck,Alpecin - Fenix,Corendon - Circus,Beobank - Corendon,Verandas Willems Cycling Team,Marlux - Napoleon Games,Sunweb - Napoleon Games Cycling Team,BKCP - Powerplus,,,,,,,Oneday,
M,WT,Red Bull - BORA - hansgrohe,VLASOV Aleksandr,Russia,30,23 April 1996,Vyborg,1.86,68,12,126,GC Tour de Romandie ('22),GC Volta a la Comunitat Valenciana ('22),Giro dell'Emilia ('20),BORA - hansgrohe,Astana - Premier Tech,Astana Pro Team,Gazprom-RusVelo,Viris Maserati - Sisal,Favorit Vyborg,,,,,,,,,Climber,
M,WT,Red Bull - BORA - hansgrohe,WANDAHL Frederik,Denmark,25,9 May 2001,Stockholm,1.78,61,0,,5th Eschborn-Frankfurt ('25),5th GC Tour de Wallonie ('24),2nd National Championships Denmark ME - Road Race ('21),BORA - hansgrohe,Team ColoQuick,NPV-Carl Ras Roskilde Junior,Børkop Cykler-Carl Ras Roskilde Junior,,,,,,,,,,,Oneday,
M,WT,Red Bull - BORA - hansgrohe,ZWIEHOFF Ben,Germany,32,22 February 1994,Essen,1.82,61,0,,2nd GC Presidential Cycling Tour of Türkiye ('23),2nd GC Czech Tour ('23),2nd stage Presidential Cycling Tour of Türkiye ('23),BORA - hansgrohe,Team Bornträger Hanau,Bergamont Racing Team,,,,,,,,,,,,GC,
M,WT,Soudal Quick-Step,BASTIAENS Ayco,Belgium,29,3 June 1996,Aalst,1.91,76,0,,3rd stage Tour of Bulgaria ('21),7th GC Tour of Bulgaria ('21),8th Grote Prijs Rik Van Looy ('22),Alpecin-Deceuninck Development Team,Alpecin-Fenix Development Team,,,,,,,,,,,,,GC,
M,WT,Soudal Quick-Step,CRAS Steff,Belgium,30,13 February 1996,Geel,1.83,67,1,,stage Vuelta Asturias ('25),3rd GC La Route d'Occitanie - CIC ('25),3rd Giro della Toscana ('25),TotalEnergies,Lotto Soudal,Team Katusha Alpecin,BMC Development Team,Lotto - Soudal U23,,,,,,,,,,GC,
M,WT,Soudal Quick-Step,DAINESE Alberto,Italy,28,25 March 1998,Abano Terme,1.75,72,7,,"2x stage Giro d'Italia ('23, '22)",stage Vuelta a España ('23),stage Arctic Race of Norway ('23),Tudor Pro Cycling Team,Team dsm - firmenich,Team DSM,Team Sunweb,SEG Racing Academy,Zalf Euromobil Désirée Fior,S.C. Padovani,,,,,,,,Sprint,
M,WT,Soudal Quick-Step,EENKHOORN Pascal,Netherlands,29,8 February 1997,Zwolle,1.85,72,5,,Heistse Pijl ('21),"2x stage Settimana Internazionale Coppi e Bartali ('20, '18)",2nd stage Tour de France ('23),Lotto Dstny,Jumbo-Visma,Team Jumbo-Visma,Team LottoNL-Jumbo,BMC Development Team,,,,,,,,,,Oneday,
M,WT,Soudal Quick-Step,GAROFOLI Gianmarco,Italy,23,6 October 2002,Ancona,1.80,62,0,235,2nd GC Giro di Sardegna ('26),stage Giro Ciclistico della Valle d'Aosta - Mont Blanc ('21),2nd GC Giro Ciclistico della Valle d'Aosta - Mont Blanc ('21),Astana Qazaqstan Team,Astana Qazaqstan Development Team,Development Team DSM,,,,,,,,,,,,Climber,
M,WT,Soudal Quick-Step,GELDERS Gil,Belgium,23,16 December 2002,Asse,1.79,66,0,,Ruota d'Oro - GP Festa del Perdono ('23),Gent-Wevelgem / Kattekoers-Ieper ('23),"2x stage Giro d'Italia Giovani Under 23 ('23, '22)",Soudal Quick-Step Devo Team,Bingoal Pauwels Sauces WB Development Team,Bingoal WB Development Team,Onder Ons Parike,,,,,,,,,,,GC,
M,WT,Soudal Quick-Step,HAYTER Ethan,Great Britain,27,18 September 1998,London,1.80,70,24,223,GC Tour de Pologne ('22),GC Tour of Norway ('21),"3x stage Tour de Romandie ('23, '22)",INEOS Grenadiers,VC Londres,Team Sky,,,,,,,,,,,,TT,
M,WT,Soudal Quick-Step,LAMPAERT Yves,Belgium,35,10 April 1991,Izegem,1.80,75,16,,"2x Dwars door Vlaanderen ('18, '17)",AG Driedaagse Brugge-De Panne ME ('20),stage Tour de France ('22),Quick-Step Alpha Vinyl Team,Deceuninck - Quick Step,Quick-Step Floors,Etixx - Quick Step,Topsport Vlaanderen - Baloise,EFC-Omega Pharma-Quick-Step,,,,,,,,,Oneday,
M,WT,Soudal Quick-Step,LANDA Mikel,Spain,36,13 December 1989,Murgia,1.72,61,16,,"2x GC Vuelta a Burgos ('21, '17)","3x stage Giro d'Italia ('17, '15)",GC Giro del Trentino ('16),Bahrain - Victorious,Bahrain - McLaren,Movistar Team,Team Sky,Astana Pro Team,Euskaltel - Euskadi,Orbea - Oreka SDA,Naturgas Energia,CC Zuyano,,,,,,Climber,
M,WT,Soudal Quick-Step,LECERF Junior,Belgium,23,15 October 2002,Halle,1.69,54,3,107,GC Czech Tour ('25),stage Czech Tour ('25),stage Tour du Rwanda ('24),Soudal Quick-Step Devo Team,Lotto - Soudal U23,CC Étupes,Acrog - Balen BC Junior,Zannata - Galloo Cyclingteam Menen,,,,,,,,,,GC,
M,WT,Soudal Quick-Step,MAGNIER Paul,France,22,14 April 2004,Laredo,1.87,70,29,6,3x stage Giro d'Italia ('26),5x stage Tour of Guangxi ('25),GP de Fourmies / La Voix du Nord ('25),Trinity Racing,Charvieu Chavagneux Isère Cyclisme,,,,,,,,,,,,,Oneday,Sprint
M,WT,Soudal Quick-Step,MERLIER Tim,Belgium,33,30 October 1992,Wortegem-Petegem,1.88,76,71,36,"3x stage Tour de France ('25, '21)","4x stage Giro d'Italia ('24, '21)","3x Scheldeprijs ('26, '25, '24)",Alpecin - Deceuninck,Alpecin - Fenix,Corendon - Circus,Pauwels sauzen - Vastgoedservice Continental Team,Vérandas Willems-Crelan,Crelan - Vastgoedservice,Pauwels - Vastgoedservice,Sunweb - Napoleon Games Cycling Team,Sunweb - Revor,CT DJ Matic Kortrijk VZW,,,,,Sprint,
M,WT,Soudal Quick-Step,PARET-PEINTRE Valentin,France,25,14 January 2001,Annemasse,1.78,52,3,119,stage Tour de France ('25),stage Giro d'Italia ('24),stage Tour of Oman ('25),Decathlon AG2R La Mondiale Team,AG2R Citroën Team,AG2R Citroën U23 Team,Van Rysel-AG2R La Mondiale,Van Rysel - AG2R La Mondiale,B'Twin U19 AG2r La Mondiale,,,,,,,,,Climber,
M,WT,Soudal Quick-Step,PEDERSEN Casper,Denmark,30,15 March 1996,Copenhagen,1.86,71,3,,Paris - Tours ('20),Figueira Champions Classic ('23),stage Tour of Denmark ('17),Team DSM,Team Sunweb,Aqua Blue Sport,Team Giant - Castelli,Riwal Platform Cycling Team,Team KEL-BERG Roskilde Junior,Team Roskilde Junior,,,,,,,,Oneday,
M,WT,Soudal Quick-Step,RACCAGNI NOVIERO Andrea,Italy,22,26 January 2004,Genua,1.85,75,0,169,6th GC Tour Down Under ('26),4th Coppa Bernocchi ('25),4th stage Tour de Pologne ('25),Soudal Quick-Step Devo Team,Team Work Service Speedy Bike,,,,,,,,,,,,,Hills,
M,WT,Soudal Quick-Step,REINDERINK Pepijn,Netherlands,24,4 May 2002,Almelo,1.80,67,0,,2x 3rd stage Tour du Rwanda ('24),13th GC Tour de Luxembourg ('25),5th stage Tour du Rwanda ('24),Soudal Quick-Step Devo Team,Development Team DSM,Acrog - Balen BC Junior,,,,,,,,,,,,Oneday,
M,WT,Soudal Quick-Step,REX Laurenz,Belgium,26,15 December 1999,Marburg,1.93,83,1,248,Le Samyn ('24),2nd Ename Samyn Classic ('26),Dorpenomloop Rucphen ('23),Intermarché - Wanty,Intermarché - Circus - Wanty,Bingoal Pauwels Sauces WB,Wallonie-Bruxelles Development Team,AGO-Aqua Service,Club Cycliste Chevigny,Lotto-VC Ardennes,,,,,,,,Oneday,
M,WT,Soudal Quick-Step,SCHACHMANN Maximilian,Germany,32,9 January 1994,Berlin,1.83,71,16,,"2x GC Paris-Nice ('21, '20)","4x stage Itzulia Basque Country ('25, '19)",GP Industria & Artigianato ('19),Red Bull - BORA - hansgrohe,BORA - hansgrohe,Quick-Step Floors,Klein Constantia,AWT-GreenWay,Development Team Giant-Shimano,Thuringer Energie Team,Alfred Lippert Team Berlin,,,,,,,GC,
M,WT,Soudal Quick-Step,STUYVEN Jasper,Belgium,34,17 April 1992,Leuven,1.87,80,9,66,Milano-Sanremo ('21),Omloop Het Nieuwsblad ME ('20),GC Deutschland Tour ('19),Lidl - Trek,Trek - Segafredo,Trek Factory Racing,Bontrager Cycling Team,Bontrager Livestrong Team,AVIA Cycling Team,,,,,,,,,Oneday,
M,WT,Soudal Quick-Step,SVRČEK Martin,Slovakia,23,17 February 2003,Nesluša,1.75,66,0,,2nd World Championships MU - Road Race ('24),3rd World Championships MU - Road Race ('23),"2x 2nd National Championships Slovakia ME - Road Race ('25, '24)",Quick-Step Alpha Vinyl Team,Biesse - Carrera,Team Franco Ballerini,,,,,,,,,,,,Oneday,
M,WT,Soudal Quick-Step,VAN BAARLE Dylan,Netherlands,34,21 May 1992,Voorburg,1.89,74,8,,Paris - Roubaix ('22),Dwars door Vlaanderen ('21),Omloop Het Nieuwsblad ME ('23),Team Visma | Lease a Bike,Jumbo-Visma,INEOS Grenadiers,Team INEOS,Team Sky,Cannondale - Drapac Pro Cycling Team,Team Cannondale - Garmin,Garmin Sharp,Rabobank Development Team,Rabobank Continental Team,,,,,Oneday,
M,WT,Soudal Quick-Step,VAN DEN BOSSCHE Fabio,Belgium,25,21 September 2000,Ghent,1.75,65,0,,2nd stage Tour of Antalya ('24),12th GC Tour de Wallonie ('21),14th Classic Brugge-De Panne ME ('25),Alpecin - Deceuninck,Sport Vlaanderen - Baloise,EFC-L&R Vulsteke,Davo CT - Tongeren Junior,,,,,,,,,,,GC,
M,WT,Soudal Quick-Step,VAN GESTEL Dries,Belgium,31,30 September 1994,Turnhout,1.88,74,2,,Ronde van Drenthe ('22),2nd Circuit Franco-Belge ('22),stage Tour des Fjords ('17),TotalEnergies,Team Total Direct Energie,Sport Vlaanderen - Baloise,Topsport Vlaanderen - Baloise,Lotto Soudal,Lotto - Soudal U23,Lotto - Belisol U23,,,,,,,,Oneday,
M,WT,Soudal Quick-Step,VAN LERBERGHE Bert,Belgium,33,29 September 1992,Kortrijk,1.90,83,0,,2nd Omloop Eurometropool ('17),2nd stage Vuelta a Andalucia Ruta Ciclista Del Sol ('16),"2x 4th Heistse Pijl ('23, '21)",Quick-Step Alpha Vinyl Team,Deceuninck - Quick Step,"Cofidis, Solutions Crédits",Sport Vlaanderen - Baloise,Topsport Vlaanderen - Baloise,EFC-Omega Pharma-Quick-Step,Ventilair - Steria,Bofrost - Steria,Koninklijke Balen BC,,,,,,Oneday,
M,WT,Soudal Quick-Step,VAN WILDER Ilan,Belgium,26,14 May 2000,Jette,1.71,64,3,110,Tre Valli Varesine ('23),GC Deutschland Tour ('23),stage Deutschland Tour ('23),Quick-Step Alpha Vinyl Team,Deceuninck - Quick Step,Team DSM,Team Sunweb,Lotto - Soudal U23,Van Moer Logistics Cycling Team,,,,,,,,,GC,
M,WT,Soudal Quick-Step,VANGHELUWE Warre,Belgium,24,23 July 2001,Tielt,1.89,79,2,,stage Tour of Guangxi ('24),stage Quatre Jours de Dunkerque ('24),Youngster Coast Challenge ('23),Soudal Quick-Step Devo Team,Team Elevate p/b Home Solution Soenens,Home Solution-Soenens,Gaverzicht - Be Okay Juniors,Meubelen Gaverzicht - Glascentra CT,,,,,,,,,,Sprint,
M,WT,Soudal Quick-Step,VANSEVENANT Mauri,Belgium,27,1 June 1999,Ostend,1.75,60,3,236,GP Industria & Artigianato ('21),stage Tour de Luxembourg ('24),stage Tour of Oman ('23),Quick-Step Alpha Vinyl Team,Deceuninck - Quick Step,EFC-L&R Vulsteke,,,,,,,,,,,,Climber,
M,WT,Soudal Quick-Step,VERVAEKE Louis,Belgium,32,6 October 1993,Ronse,1.81,68,1,,stage Tour of Oman ('25),GC Le Tour de Savoie Mont Blanc ('14),GC Ronde de l'Isard ('14),Quick-Step Alpha Vinyl Team,Alpecin - Fenix,Team Sunweb,Lotto Soudal,Lotto Belisol,Bofrost - Steria,,,,,,,,,GC,
