M,WT,XDS Astana Team,LÓPEZ Harold Martín,Ecuador,25,3 December 2000,Ibarra,1.60,55,4,,GC Tour de Hongrie ('25),GC Tour of Hellas ('25),stage Presidential Cycling Tour of Türkiye ('25),Astana Qazaqstan Team,Astana Qazaqstan Development Team,Best PC Ecuador,Movistar Team Ecuador,,,,,,,,,,,GC,
M,WT,XDS Astana Team,MALUCELLI Matteo,Italy,32,20 October 1993,Forlì,1.71,68,18,92,GC Tour of Taihu Lake ('25),"6x stage Tour de Langkawi ('25, '24)",2x stage Tour of Taihu Lake ('25),JCL Team UKYO,Bingoal WB,China Glory Continental Cycling Team,Gazprom - RusVelo,Androni Giocattoli - Sidermec,Caja Rural - Seguros RGA,Androni - Sidermec - Bottecchia,Unieuro Wilier,Team Idea 2010 ASD,,,,,,Sprint,
M,WT,XDS Astana Team,MULUBRHAN Henok,Eritrea,26,11 November 1999,Asmara,1.76,60,13,81,"3x African Continental Championships ME - Road Race ('24, '23, '22)","2x GC Tour of Qinghai Lake ('25, '23)",GC Tour du Rwanda ('23),Astana Qazaqstan Team,Green Project - Bardiani CSF - Faizanè,Bardiani-CSF-Faizanè,BIKE AID,Team Qhubeka,NTT Continental Cycling Team,UCI WCC Men's Team,,,,,,,,GC,
M,WT,XDS Astana Team,RODRÍGUEZ Cristián,Spain,31,3 March 1995,El Ejido,1.78,59,3,145,GC Tour du Rwanda ('21),Mercan'Tour Classic Alpes-Maritimes ('25),2nd GC Vuelta a Andalucia Ruta Ciclista Del Sol ('22),Arkéa - B&B Hotels,Team Arkéa Samsic,TotalEnergies,Caja Rural - Seguros RGA,Wilier Triestina - Selle Italia,Wilier - Southeast,Southeast,,,,,,,,GC,
M,WT,XDS Astana Team,ROMELE Alessandro,Italy,22,30 August 2003,Iseo,1.86,71,0,,2nd GC Tour of Istanbul ('24),Gran Premio della Liberazione ('23),2x stage Tour of Rhodes ('24),Astana Qazaqstan Development Team,Team Colpack Ballan CSB,Team Colpack Ballan,Ciclistica Trevigliese,,,,,,,,,,,Hills,Oneday
M,WT,XDS Astana Team,SCARONI Christian,Italy,28,16 October 1997,Brescia,1.75,63,10,14,GC Tour of Oman ('26),stage Giro d'Italia ('25),GC Tour des Alpes-Maritimes ('25),Astana Qazaqstan Team,Gazprom - RusVelo,Equipe continentale Groupama-FDJ,Sangemini - MG.Kvis,GC Feralpi Monteclarense,,,,,,,,,,Oneday,
M,WT,XDS Astana Team,SCHRETTL Marco,Austria,22,11 September 2003,Münster,1.81,63,0,,GC Orlen Nations Grand Prix ('25),Trofeo Città di San Vendemiano ('25),3rd World Championships MU - Road Race ('25),Tirol KTM Cycling Team,Trinity Racing,Team Auto Eder,,,,,,,,,,,,Oneday,
M,WT,XDS Astana Team,SILVA Guillermo Thomas,Uruguay,24,30 December 2001,Maldonado,1.75,64,8,62,GC Tour of Hainan ('26),stage Giro d'Italia ('26),2x stage Tour of Hainan ('26),Caja Rural - Seguros RGA,Caja Rural - Alea,,,,,,,,,,,,,Hills,
M,WT,XDS Astana Team,SU Haoyu,China,25,26 October 2000,,1.81,66,0,,2nd Asian Continental Championships ME - Road Race ('26),2nd National Championships China - Road Race ('25),2nd National Championships China - ITT ('25),China Glory - Mentech Continental Cycling Team,China Glory Continental Cycling Team,Li Ning Star Cycling Team,,,,,,,,,,,,Oneday,
M,WT,XDS Astana Team,SYRITSA Gleb,Russia,26,14 April 2000,Saint Petersburg,1.90,85,5,,"4x stage Tour de Langkawi ('24, '23, '22)",stage Baku-Khankendi Azerbaijan Cycling race ('26),Circuito del Porto - Trofeo Arvedi ('21),XDS Astana Development Team,Astana Qazaqstan Team,C.C. Catalunya - Barcelona,Lokosphinx,Lokosphnix Juniors,,,,,,,,,,Sprint,
M,WT,XDS Astana Team,TEJADA Harold,Colombia,29,27 April 1997,Pitalito,1.80,63,2,70,stage Paris-Nice ('26),stage Tour Colombia ('24),4th GC UAE Tour ('26),Astana Qazaqstan Team,Astana - Premier Tech,Astana Pro Team,Medellín,EPM,,,,,,,,,,Climber,
M,WT,XDS Astana Team,TEUNISSEN Mike,Netherlands,33,25 August 1992,Ysselsteyn,1.84,73,8,133,stage Tour de France ('19),GC Quatre Jours de Dunkerque ('19),GC ZLM Tour ('19),Intermarché - Wanty,Intermarché - Circus - Wanty,Jumbo-Visma,Team Jumbo-Visma,Team Sunweb,Team LottoNL-Jumbo,Rabobank Development Team,,,,,,,,Oneday,
M,WT,XDS Astana Team,TONEATTI Davide,Italy,25,9 April 2001,Tolmezzo,1.80,65,0,,GC Turul Romaniei ('24),stage Belgrade Banjaluka ('24),2nd GC Belgrade Banjaluka ('24),Astana Qazaqstan Development Team,,,,,,,,,,,,,,Hills,
M,WT,XDS Astana Team,ULISSI Diego,Italy,36,15 July 1989,Cecina,1.75,63,49,125,"8x stage Giro d'Italia ('20, '16, '15, '14, '11)",Grand Prix Cycliste de Montréal ('17),GC Presidential Cycling Tour of Turkey ('17),UAE Team Emirates,Lampre - Merida,Lampre - ISD,Lampre - Farnese Vini,Team Hopplà Seano Bellissima,Seano Vangi - Molino di Ferro,Cycling Team Vangi Sparo Caparol,,,,,,,,Oneday,
M,WT,XDS Astana Team,VAN BEKKUM Darren,Netherlands,24,20 March 2002,Amersfoort,1.76,62,0,,GC Ronde de l'Isard ('24),stage Ronde de l'Isard ('24),2nd GC Istarsko Proljeće - Istrian Spring Trophy ('24),Team Visma | Lease a Bike Development,Jumbo-Visma Development Team,,,,,,,,,,,,,Climber,
M,WT,XDS Astana Team,VELASCO Simone,Italy,30,2 December 1995,Bologna,1.70,59,5,158,Trofeo Laigueglia ('19),stage Volta a la Comunitat Valenciana ('23),stage Settimana Internazionale Coppi e Bartali ('19),Astana Qazaqstan Team,Gazprom - RusVelo,Neri Sottoli - Selle Italia - KTM,Wilier Triestina - Selle Italia,Bardiani - CSF,Zalf Euromobil Désirée Fior,,,,,,,,,Oneday,
M,WT,XDS Astana Team,VINOKUROV Nicolas,Kazakhstan,23,7 July 2002,Nice,1.84,69,0,138,Asian Continental Championships MU - ITT ('24),2nd Asian Continental Championships ME - ITT ('26),4th GC Tour de Langkawi ('25),Astana Qazaqstan Team,Astana Qazaqstan Development Team,Vino - Astana Motors,UC Monaco,,,,,,,,,,,GC,
W,PT,Cofidis Women Team,ALZINI Martina,Italy,29,10 February 1997,Legnano,1.80,64,2,210,stage Tour de Normandie Féminin ('23),stage Bretagne Ladies Tour CERATIZIT ('22),Egmont Cycling Race Women ('25),Valcar - Travel & Service,Équipe Paule Ka,Bigla Pro Cycling,Astana Womens Team,Alé Cipollini,,,,,,,,,,Sprint,
W,PT,Cofidis Women Team,BEGO Julie,France,21,9 January 2005,Bourgoin-Jallieu,,,0,198,3rd Alpes Gresivaudan Classic ('24),4th Trofeo Oro in Euro ('24),5th Tre Valli Varesine Women's Race ('24),,,,,,,,,,,,,,,Oneday,
W,PT,Cofidis Women Team,BERTEAU Victoire,France,25,16 August 2000,Lambres-lez-Douai,1.65,57,1,231,National Championships France WE - Road Race ('23),2nd Grand Prix International d'Isbergues ('24),2nd Grand Prix du Morbihan Féminin ('24),Doltcini - Van Eyck - Proximus CT,Doltcini - Van Eyck Sport,,,,,,,,,,,,,Oneday,
W,PT,Cofidis Women Team,BORRAS Marion,France,28,24 November 1997,Pontcharra,,,0,,5th Paris-Roubaix Femmes ('23),5th GC Bretagne Ladies Tour ('26),6th Chrono des Nations ('21),St Michel - Mavic - Auber93 WE,Team Féminin Auvergne - Rhône-Alpes,,,,,,,,,,,,,TT,
W,PT,Cofidis Women Team,BURLOVÁ Kristýna,Czechia,24,25 March 2002,Plzeň,,,1,,National Championships Czech Republic WE - Road Ra ('25),2nd National Championships Czech Republic WE - Road Ra ('23),2nd National Championships Czech Republic WE - ITT ('23),CERATIZIT Pro Cycling Team,Team Dukla Praha,Lifeplus Wahoo,Lotto Dstny Ladies,Lotto Soudal Ladies,,,,,,,,,,Oneday,
W,PT,Cofidis Women Team,COMTE Ema,France,21,24 March 2005,Saint-Julien-en-Genevois,,,0,188,4th GC Bretagne Ladies Tour ('26),3rd stage Bretagne Ladies Tour ('26),6th GC Vuelta Extremadura Féminas ('26),Team Féminin Chambéry,Team Féminin Auvergne - Rhône-Alpes,,,,,,,,,,,,,Hills,
W,PT,Cofidis Women Team,DIDERIKSEN Amalie,Denmark,30,24 May 1996,Kastrup,1.75,62,15,76,World Championships WE - Road Race ('16),Ronde van Drenthe ('17),"3x stage Boels Rental Ladies Tour ('18, '16)",Uno-X Mobility,Uno-X Pro Cycling Team,Trek - Segafredo,Trek-Segafredo Women,Boels - Dolmans Cycling Team,,,,,,,,,,Oneday,
W,PT,Cofidis Women Team,FORTIN Valentine,France,27,24 April 1999,Toulouse,1.64,55,4,138,2x stage Bretagne Ladies Tour CERATIZIT ('23),A Travers les Hauts de France ('23),Grand Prix International d'Isbergues ('23),St Michel - Auber93,,,,,,,,,,,,,,Sprint,
W,PT,Cofidis Women Team,GEURTS Mijntje,Netherlands,22,25 October 2003,Veldhoven,,,0,,10th La Flèche Wallonne Féminine ('25),7th Grand Prix du Morbihan Féminin ('26),20th Amstel Gold Race Ladies Edition ('23),Team Visma | Lease a Bike,Lotto Dstny Ladies,Lotto Soudal Ladies,WV Schijndel,,,,,,,,,,,Hills,
W,PT,Cofidis Women Team,GUILMAN Victorie,France,30,25 March 1996,Angoulême,,,1,,Grand Prix Féminin de Chambéry ('23),2nd Grand Prix Féminin de Chambéry ('22),6th GC Santos Women's Tour Down Under ('24),St Michel - Mavic - Auber93 WE,FDJ - SUEZ,FDJ - SUEZ - Futuroscope,FDJ Nouvelle Aquitaine Futuroscope,Poitou-Charentes.Futuroscope.86,DN 17 Poitou-Charentes,,,,,,,,,Hills,
W,PT,Cofidis Women Team,KERN Špela,Slovenia,36,24 February 1990,Ljubljana,,,0,,"4x 2nd National Championships Slovenia WE - Road Race ('22, '20, '17, '13)","8x 3rd National Championships Slovenia WE - Road Race ('25, '24, '23, '21, '18, '16, '15, '14)","2x 6th Alpes Gresivaudan Classic ('23, '22)",Massi - Tactic Women Team,Lviv Cycling Team women,BTC City Ljubljana,Health Mate - Cyclelive Team,Bizkaia-Durango,,,,,,,,,,Oneday,
W,PT,Cofidis Women Team,LUDWIG Hannah,Germany,26,15 February 2000,Heidelberg,1.65,55,1,,Navarra Women's Elite Classics ('24),2x 3rd stage Baloise Ladies Tour ('21),"2x 6th GC BeNe Ladies Tour ('21, '19)",Uno-X Pro Cycling Team,Canyon//SRAM Racing,,,,,,,,,,,,,TT,
W,PT,Cofidis Women Team,MUL Malwina,Poland,22,28 February 2004,Leżajsk,,,2,191,stage Tour de Feminin ('23),stage Gracia ('23),2nd GC Tour de Feminin ('25),MAT Atom Deweloper Wrocław,,,,,,,,,,,,,,Hills,
W,PT,Cofidis Women Team,NOSKOVÁ Nikola,Czechia,28,1 July 1997,Jablonec nad Nisou,1.56,42,5,161,Giro del Trentino Alto Adige - Sudtirol ('17),"3x National Championships Czech Republic WE - ITT ('21, '20, '17)",National Championships Czech Republic WE - Road Ra ('17),Massi - Tactic Women Team,Zaaf Cycling Team,Team SD Worx,Équipe Paule Ka,Bigla Pro Cycling,Bepink,Bepink Cogeas,,,,,,,,Hills,
W,PT,Cofidis Women Team,QUAGLIOTTO Nadia,Italy,29,22 March 1997,Montebelluna,,,0,,2nd stage Giro d'Italia Internazionale Femminile ('19),3rd Trofeo Binissalem-Andratx ('24),4th Women Cycling Pro Costa De Almería ('24),Laboral Kutxa - Fundación Euskadi,Laboral Kutxa Fundación Euskadi,Bepink,Cronos Casa Dorada Women Cycling,Alé Cipollini,Top Girls Fassa Bortolo,,,,,,,,,Hills,
W,PT,Laboral Kutxa - Fundación Euskadi,AMONDARAIN Naia,Spain,25,13 February 2001,Ibarra,,,0,237,3rd GC Tour El Salvador ('26),4th Grand Prix el Salvador ('26),4th stage Tour El Salvador ('26),Laboral Kutxa Fundación Euskadi,Sopela Women's Team,,,,,,,,,,,,,Hills,
W,PT,Laboral Kutxa - Fundación Euskadi,ARANGUREN Irati,Spain,18,8 December 2007,Usurbil,,,0,,20th Pionera Race ('26),22nd Omloop van het Hageland ('26),26th Samyn Ladies ('26),Andoaingo Txirrindulari Eskola,,,,,,,,,,,,,,Hills,
W,PT,Laboral Kutxa - Fundación Euskadi,ARZUFFI Alice Maria,Italy,31,19 November 1994,Giussano,1.65,52,0,,3rd stage Giro d'Italia Internazionale Femminile ('18),4th La Classique Morbihan ('18),3rd stage Baloise Ladies Tour ('23),CERATIZIT-WNT Pro Cycling Team,CERATIZIT-WNT Pro Cycling,Valcar - Travel & Service,Bizkaia Durango,Valcar Cylance Cycling,Bizkaia Durango - Euskadi Murias,Lensworld - Kuota,Lensworld - Zannata,Team Inpa Sottoli Bianchi Giusfredi,Astana BePink Womens Team,BePink,Faren-Let's Go Finland,,,Hills,
W,PT,Laboral Kutxa - Fundación Euskadi,BIRIUKOVA Yuliia,Ukraine,28,24 January 1998,Lviv,,,5,72,Grand Prix el Salvador ('26),stage Internationale LOTTO Thüringen Ladies Tour ('22),"2x National Championships Ukraine WE - ITT ('25, '24)",Human Powered Health,UAE Development Team,Arkéa Pro Cycling Team,Eneicat - RBH Global,Lviv Cycling Team women,,,,,,,,,,Climber,
W,PT,Laboral Kutxa - Fundación Euskadi,ERASO Idoia,Spain,24,27 February 2002,Pamplona,,,0,,7th GC Tour El Salvador ('26),8th Grand Prix el Salvador ('26),10th Grand Prix Longitudinal del Norte ('26),Laboral Kutxa Fundación Euskadi,Sopela Women's Team,,,,,,,,,,,,,Hills,
W,PT,Laboral Kutxa - Fundación Euskadi,FIDANZA Arianna,Italy,31,6 January 1995,Bergamo,,,4,107,Women Cycling Pro Costa De Almería ('23),Pionera Race ('26),Tour of Taiyuan International Women's Road Cycling ('19),CERATIZIT-WNT Pro Cycling Team,CERATIZIT-WNT Pro Cycling,Team BikeExchange - Jayco,Team BikeExchange,Lotto Soudal Ladies,Eurotarget - Bianchi - Vittoria,Eurotarget - Bianchi - Vitasana,Astana Womens Team,Astana Women's Team,Alé Cipollini,Estado de México-Faren Kuota,,,,Sprint,
W,PT,Laboral Kutxa - Fundación Euskadi,FIORIN Sara,Italy,22,24 September 2003,Desio,,,3,,stage Tour El Salvador ('25),Omloop der Kempen ('24),Umag Trophy LADIES ('24),CERATIZIT Pro Cycling Team,UAE Development Team,G.S. Gauss,,,,,,,,,,,,Sprint,
W,PT,Laboral Kutxa - Fundación Euskadi,JØRGENSEN Tiril,Norway,25,29 October 2000,Harstad,,,0,,4th GC Volta a Portugal Feminina ('25),9th Navarra Women's Elite Classics ('25),13th GC Tour of Chongming Island ('23),Team Coop - Repsol,Team Coop - Hitec Products,,,,,,,,,,,,,Hills,
W,PT,Laboral Kutxa - Fundación Euskadi,KUSKOVA Yanina,uz,24,5 December 2001,Tashkent,,,13,87,Asian Continental Championships WE - ITT ('25),"4x National Championships Uzbekistan WE - Road Race ('24, '23, '21, '20)","3x National Championships Uzbekistan WE - ITT ('25, '21, '20)",Queen Sport,Tashkent City Women Professional Cycling Team,,,,,,,,,,,,,Hills,
W,PT,Laboral Kutxa - Fundación Euskadi,OSTOLAZA Usoa,Spain,28,25 February 1998,Zarautz,,,8,16,"2x GC Tour Féminin International des Pyrénées ('25, '24)",Gran Premio Ciudad de Eibar ('26),"2x stage Tour Féminin International des Pyrénées ('25, '24)",Laboral Kutxa Fundación Euskadi,,,,,,,,,,,,,,Hills,
W,PT,Laboral Kutxa - Fundación Euskadi,PATIÑO Paula,Colombia,29,29 March 1997,La Ceja,1.55,47,6,82,GC Tour El Salvador ('26),Grand Prix Longitudinal del Norte ('26),stage Tour El Salvador ('26),Movistar Team,UCI WCC Womens team,,,,,,,,,,,,,Hills,
W,PT,Laboral Kutxa - Fundación Euskadi,RUFFILLI Vittoria,Italy,24,3 April 2002,Novara,,,0,,21st Grand Prix Boquerón ('25),27th stage Tour Cycliste Féminin International de l'Ardèche ('24),31st GC Premondiale Giro Toscana Int. Femminile - Memorial ('24),Roland Le Dévoluy,A.S.D. K2 Women Team,GB Junior Team Piemonte Pedale Castanese A.S.D.,Pool Cantù 1999 - GB Junior Team,GB Junior Team,,,,,,,,,,GC,
W,PT,Laboral Kutxa - Fundación Euskadi,SILVESTRI Debora,Italy,28,8 May 1998,Isola della Scala,,,2,175,Gran Premio Ciudad de Eibar ('25),Pionera Race ('24),4th GC Setmana Ciclista Valenciana - Vuelta Comunitat V ('21),Laboral Kutxa Fundación Euskadi,Zaaf Cycling Team,Top Girls Fassa Bortolo,Eurotarget - Bianchi - Vittoria,Eurotarget - Bianchi - Vitasana,,,,,,,,,,Hills,
W,PT,Laboral Kutxa - Fundación Euskadi,SOTO Catalina Anais,cl,25,8 April 2001,Santiago,,,8,78,Pan American Championships WE - Road Race ('26),2x stage Tour El Salvador ('26),"3x National Championships Chile WE - ITT ('26, '25, '22)",Bizkaia Durango,NXTG Racing,WCC Team,,,,,,,,,,,,Oneday,
W,PT,Laboral Kutxa - Fundación Euskadi,TONETTI Cristina,Italy,23,6 July 2002,Besana Brianza,,,1,174,Grote Prijs Yvonne Reynders ('25),3rd Grand Prix Féminin de Chambéry ('22),2nd Gran Premio Della Liberazione Donne ('23),Top Girls Fassa Bortolo,A.S.D. VO2 Team Pink,,,,,,,,,,,,,Hills,
W,PT,Laboral Kutxa - Fundación Euskadi,VAN 'T GELOOF Marjolein,Netherlands,30,27 March 1996,Dirksland,,,3,119,Grote Prijs Beerens ('22),Grand Prix de Oriente ('26),stage Tour El Salvador ('26),Arkéa - B&B Hotels Women,Hess Cycling Team,Human Powered Health,Le Col - Wahoo,Drops - Le Col s/b TEMPUR.,Drops,Alé Cipollini,Lotto Soudal Ladies,GRC Jan van Arckel,,,,,,Sprint,
W,PT,Lotto Intermarché Ladies,BOELS Dina,Belgium,21,14 January 2005,Bonheiden,,,0,,6th National Championships Belgium WE - Road Race ('25),15th stage Tour de Pologne Women ('24),19th stage Tour de Pologne Women ('24),Lotto Ladies,Lotto Dstny Ladies,Van Moer Logistics Cycling Team,,,,,,,,,,,,Oneday,
W,PT,Lotto Intermarché Ladies,BROUWERS Julie,Belgium,23,23 December 2002,Geel,,,0,,23rd GP Schellebelle ('26),32nd National Championships Belgium WE - Road Race ('22),38th National Championships Belgium WE - Road Race ('23),KDM - Pack Cycling Team vzw,KDM - Pack Cycling Team,,,,,,,,,,,,,,
W,PT,Lotto Intermarché Ladies,DE CLERCQ Katrijn,Belgium,24,5 February 2002,Oosterzele,,,0,127,Grote Prijs CHW Beveren ('25),3rd SPAR Flanders Diamond Tour ('23),7th Ronde van Brugge - Tour of Bruges WE ('26),Lotto Ladies,Lotto Dstny Ladies,Lotto Soudal Ladies,,,,,,,,,,,,Sprint,
W,PT,Lotto Intermarché Ladies,EBRAS Elisabeth,Estonia,21,22 July 2004,Tallinn,,,1,199,National Championships Estonia WE - Road Race ('25),"2x 2nd National Championships Estonia WE - ITT ('24, '23)",2nd Poreč Trophy LADIES ('24),BePink - Imatra - Bongioanni,Hess Cycling Team,UAE Development Team,Team Rytger Development,,,,,,,,,,,Sprint,
W,PT,Lotto Intermarché Ladies,HINOJOSA Romina,Mexico,23,30 November 2002,Tampico,,,0,,"2x 2nd National Championships Mexico WE - Road Race ('25, '23)",2nd stage Giro Mediterraneo Rosa ('24),15th Tour of Guangxi ('25),Lotto Ladies,A.R. Monex Women's Pro Cycling Team,Boneshaker Project presented by ORANGE SEAL,ROXO Racing,,,,,,,,,,,Hills,
W,PT,Lotto Intermarché Ladies,MEERT Marieke,Belgium,26,7 October 1999,Dendermonde,,,0,246,stage Gracia ('25),6th GP Oetingen ('23),2nd stage Gracia ('25),VolkerWessels Cycling Team,VolkerWessels Women's Pro Cycling Team,Cyclingteam Belco / Van Eyck,,,,,,,,,,,,Hills,
W,PT,Lotto Intermarché Ladies,NIJSSEN Annelies,Belgium,23,23 August 2002,Rocourt,,,0,,KOM Bretagne Ladies Tour ('26),12th KOM Vuelta España Femenina ('26),19th GC Bretagne Ladies Tour ('26),Cyclingteam Belco / Van Eyck,,,,,,,,,,,,,,Hills,Oneday
W,PT,Lotto Intermarché Ladies,RIEDMANN Linda,Germany,23,23 March 2003,Karbach,,,0,103,"2x 3rd Women's Cycling Grand Prix Stuttgart & Region ('25, '23)",3rd stage Thüringen Ladies Tour ('24),4th stage Tour of Scandinavia ('22),Team Visma | Lease a Bike,Team Jumbo-Visma,,,,,,,,,,,,,Hills,
W,PT,Lotto Intermarché Ladies,SEYNAVE Ilken,Belgium,19,11 December 2006,Roeselare,,,0,,15th GP Schellebelle ('26),42nd Ronde van Brugge - Tour of Bruges WE ('26),44th GP Schellebelle ('25),Lotto Ladies,GMS Cycling Team Glabbeek,Maes CT Glabbeek,,,,,,,,,,,,Oneday,
W,PT,Lotto Intermarché Ladies,TAS Sandrine,Belgium,30,7 September 1995,Ostend,1.71,55,2,193,2x stage Bretagne Ladies Tour ('26),2nd GC Bretagne Ladies Tour ('26),3rd Omloop der Kempen ('26),Cyclingteam Belco / Van Eyck,Lviv Cycling Team women,,,,,,,,,,,,,Sprint,
W,PT,Lotto Intermarché Ladies,TEUTENBERG Lea Lin,Germany,26,2 July 1999,Mettmann,1.67,53,0,,9th La Classique Morbihan ('23),17th GC RideLondon Classique ('23),18th In Flanders Fields - In Wevelgem ('23),Lotto Ladies,CERATIZIT-WNT Pro Cycling Team,CERATIZIT-WNT Pro Cycling,Ceratizit-WNT Pro Cycling,WNT-Rotor Pro Cycling,,,,,,,,,,Oneday,
W,PT,Lotto Intermarché Ladies,VAN WERSCH Anna,Netherlands,24,14 August 2001,Nootdorp,,,0,232,2nd Grote Prijs Beerens ('24),2nd Grote Prijs CHW Beveren ('25),2nd stage Tour de Pologne Women ('24),Lotto Ladies,Lotto Dstny Ladies,Van der Velden Adviseurs - MTD,Memorial Santos - Saddledrunk,,,,,,,,,,,Sprint,
W,PT,Lotto Intermarché Ladies,VERVLOET Sterre,Belgium,22,26 November 2003,Turnhout,,,0,,4th Grote Prijs Yvonne Reynders ('24),18th Midwest Cycling Classic ('26),11th National Championships Belgium WE - ITT ('23),Lotto Ladies,Lotto Dstny Ladies,Lotto Soudal Ladies,,,,,,,,,,,,Sprint,
W,PT,Lotto Intermarché Ladies,WITTEVRONGEL Lani,Belgium,21,12 July 2004,Bruges,,,0,,19th GC Tour of Chongming Island ('25),8th stage Tour of Chongming Island ('25),14th Midwest Cycling Classic ('26),Lotto Ladies,Chevalmeire,Duolar-Chevalmeire Cycling Team,Doltcini - Van Eyck Sport - Animotion,,,,,,,,,,,Sprint,
W,PT,Ma Petite Entreprise,ABGRALL Noémie,France,26,1 December 1999,Morlaix,,,0,,3rd National Championships France WE - Road Race ('22),8th GC Tour de Normandie Féminin ('23),4th Tour du Haut Limousin Féminin ('26),Team Claris Automobiles Ladynamips RVC,Winspace,Stade Rochelais Charente-Maritime,Stade Rochelais Charente-Maritime Women Cycling,Charente-Maritime Women Cycling,,,,,,,,,,Hills,
W,PT,Ma Petite Entreprise,ASENCIO Laura,France,28,14 May 1998,Valence,1.57,47,0,,2nd Pionera Race ('26),5th Vuelta CV Feminas ('20),3rd La Picto - Charentaise ('21),Arkéa - B&B Hotels Women,CERATIZIT-WNT Pro Cycling Team,CERATIZIT-WNT Pro Cycling,Ceratizit-WNT Pro Cycling,WNT-Rotor Pro Cycling,,,,,,,,,,Hills,
W,PT,Ma Petite Entreprise,AVOINE Alison,France,26,5 January 2000,Le Cateau-Cambrésis,,,0,,11th Surf Coast Classic ('25),13th Schwalbe Women's One Day Classic ('25),14th La Classique Morbihan ('26),St Michel - Preference Home - Auber93 WE,St Michel - Mavic - Auber93 WE,St Michel - Auber93 WE,,,,,,,,,,,,Oneday,
W,PT,Ma Petite Entreprise,COSTON Morgane,France,35,28 December 1990,Bellevue-la-Montagne,1.62,47,0,,2nd Grand Prix Presidente ('25),2nd GC Tour de Feminin ('21),3rd Alpes Gresivaudan Classic ('23),Roland Le Dévoluy,Cofidis Women Team,Arkéa Pro Cycling Team,Macogep Tornatech Girondins de Bordeaux,Chambéry Cyclisme Compétition,Servetto - Piumate - Beltrami TSA,,,,,,,,,Climber,
W,PT,Ma Petite Entreprise,LATIMIER Clémence,France,22,24 August 2003,Saint-Martin-d'Hères,,,0,247,9th Grand Prix Féminin de Chambéry ('26),10th Pionera Race ('26),12th Alpes Gresivaudan Classic ('25),Arkéa - B&B Hotels Women,Team Féminin Chambéry,,,,,,,,,,,,,Hills,
W,PT,Ma Petite Entreprise,LE MOUËL Célia,France,25,20 July 2000,Saint-Malo,,,0,,6th Grand Prix du Morbihan Féminin ('26),6th Grand Prix Presidente ('25),2x 5th stage Tour Cycliste Féminin International de l'Ardèche ('24),CERATIZIT Pro Cycling Team,St Michel - Mavic - Auber93 WE,Emotional.fr-Tornatech-GSC Blagnac VS31,Stade Rochelais Charente-Maritime Women Cycling,Charente-Maritime Women Cycling,,,,,,,,,,TT,
W,PT,Ma Petite Entreprise,MAHÉ Océane,France,24,12 February 2002,Sallanches,1.64,52,0,,Tour du Haut Limousin Féminin ('26),2nd stage Volta a Portugal Feminina ('25),5th GC Vuelta Extremadura Féminas ('24),Arkéa - B&B Hotels Women,UVCA Troyes,Team Féminin Auvergne - Rhône-Alpes,,,,,,,,,,,,Hills,
W,PT,Ma Petite Entreprise,MARASCO Margot,France,21,22 January 2005,Metz,,,0,,11th Clasica de Almeria ('26),11th Festival Elsy Jacobs à Luxembourg ('25),7th stage Tour Cycliste Féminin International de l'Ardèche ('25),AG Insurance - Soudal U23,AG Insurance - Soudal NXTG,AG Insurance-NXTG U19,,,,,,,,,,,,Oneday,
W,PT,Ma Petite Entreprise,ROUAT Ilona,France,20,30 May 2006,Quimperlé,,,0,,7th Région Pays de la Loire Tour - Féminin ('26),6th stage Bretagne Ladies Tour ('26),15th La Classique Morbihan ('26),St Michel - Preference Home - Auber93 WE,Team Breizh Ladies,,,,,,,,,,,,,Hills,
W,PT,Ma Petite Entreprise,STERN Léa,Switzerland,24,25 September 2001,Bulle,1.66,52,0,,4th stage Tour El Salvador ('25),6th GC Gracia ('25),10th Grand Prix Surf City ('25),KDM - Pack Cycling Team vzw,Lyon Sprint Evolution,Team Grand Est - Komugi - La Fabrique,Roland Cogeas Edelweiss Squad,,,,,,,,,,,TT,
W,PT,Mayenne Monbana My Pie,ALLIONE Marine,France,25,7 April 2001,Hyères,,,0,,6th Vuelta CV Feminas ('26),9th Pionera Race ('26),6th La Périgord Ladies ('22),Winspace Orange Seal,Winspace,Stade Rochelais Charente-Maritime,Stade Rochelais Charente-Maritime Women Cycling,,,,,,,,,,,Hills,
W,PT,Mayenne Monbana My Pie,COUTINHO Alice,France,25,13 September 2000,Toulouse,,,0,,3rd Gran Premio Ciudad de Eibar ('25),8th Pionera Race ('26),8th GC Premondiale Giro Toscana Int. Femminile - Memorial ('25),Massi-Baix Ter,Eneicat - CMTeam,Abadiño Cycling Academy,Sopela Women's Team,Charente-Maritime Women Cycling,,,,,,,,,,Hills,
W,PT,Mayenne Monbana My Pie,FRANCIS Jenaya,Canada,21,8 September 2004,Edmonton,,,0,,6th GC Tour de Feminin ('24),14th GC Vuelta Extremadura Féminas ('25),6th National Championships Canada WE - Road Race ('23),Winspace Orange Seal,Grouwels-Watersley R&D Road Team,,,,,,,,,,,,,Hills,
W,PT,Mayenne Monbana My Pie,GEGU Justine,France,26,5 June 1999,Laval,,,0,,2nd Région Pays de la Loire Tour - Féminin ('26),3rd stage Bretagne Ladies Tour ('26),10th La Classique Morbihan ('25),Team Elles - Groupama - Pays de Loire,Team Elles Pays de Loire,Team Elles Pays de la Loire,,,,,,,,,,,,Sprint,
W,PT,Mayenne Monbana My Pie,HALL Francesca,Great Britain,31,11 April 1995,King's Lynn,1.57,47,1,121,Grand Prix San Salvador ('26),2nd Grand Prix Longitudinal del Norte ('26),2nd Grand Prix el Salvador ('26),Roland Cogeas Cycling Team,Team Buffaz Gestion de Patrimoine,Praties Cycling Team,DAS - Hutchinson - Brother - UK,DAS - Handsling,,,,,,,,,,Hills,
W,PT,Mayenne Monbana My Pie,LYLYK Kiara,Canada,21,9 June 2004,Guelph,,,0,,4th Grand Prix el Salvador ('24),4th Grand Prix Surf City ('24),4th Tour de Gatineau ('23),Winspace Orange Seal,Boneshaker Project presented by ORANGE SEAL,Grouwels-Watersley R&D Road Team,,,,,,,,,,,,Oneday,
W,PT,Mayenne Monbana My Pie,MANGAN Fiona,Ireland,30,16 May 1996,Limerick,,,2,157,National Championships Ireland WE - ITT ('24),National Championships Ireland WE - Road Race ('24),3rd Navarra Women's Elite Classics ('26),Winspace Orange Seal,Cynisca Cycling,Soltec Team,IBCT,,,,,,,,,,,Oneday,
W,PT,Mayenne Monbana My Pie,MRUGAL Allison,United States,29,21 July 1996,West Chester,,,0,,6th Région Pays de la Loire Tour - Féminin ('24),9th GC Giro Mediterraneo Rosa ('24),15th Festival Elsy Jacobs à Luxembourg ('25),Cynisca Cycling,Sopela Women's Team,,,,,,,,,,,,,Hills,
W,PT,Mayenne Monbana My Pie,PEREKITKO Karolina,Poland,27,1 October 1998,Pruszcz Gdański,,,0,180,3rd Women Cycling Pro Costa De Almería ('24),2nd stage Tour Cycliste Féminin International de l'Ardèche ('24),2nd National Championships Poland WE - Road Race ('23),Winspace Orange Seal,Winspace,Team Groupe Abadie,Lviv Cycling Team women,Massi - Tactic Women Team,De Sprinters Malderen,,,,,,,,,Hills,
W,PT,Mayenne Monbana My Pie,QUINN Natalie,United States,24,23 December 2001,Ogden,,,0,,6th Maryland Cycling Classic Women ('25),10th Festival Elsy Jacobs à Garnich ('25),15th Kreiz Breizh Elites Féminin ('25),Cynisca Cycling,Hess Cycling Team,EF-Oatly-Cannondale,CCB - Alpine Carbon p/b Levine Law Group Women’s Cycling,,,,,,,,,,,Hills,
